#乞讨儿童~人贩子~拐卖~打拐~寻子#帮忙扩散，今天上午一个三岁多小女孩在锦绣花园小区附近被人拐走了，小女孩能说出她爸爸的手机号码 从监控上看是被一个四十多岁男人抱走了现大人都急疯了 有知情者请告之 万分感谢 看到信息的兄弟姐妹留意一下 联系人 张静杰13759695559                 ,你受骗上当了，这是虚假消息！请看辟谣网址（http://weibo.com/2805765994/C3LR17rPL）。尽快删除帖子，因为已被举报。;,2015/3/26 21:21,rumor
人贩子应被诸之急找孩子， 大连 实验小学 寻人启事 13759695559 帮忙扩散，今天上午一个三岁多小女孩在大连锦绣花园小区附近被人拐走了，小女孩能说出她爸爸的手机号码 从监控上看是被一个四十多岁男人抱走了现大人都急疯了 有知情者请告之 万分感谢 看到信息请留意一下 联系人 张静杰13759695559                 ,转发：寻人启事 13940292999。有线索酬金10万 帮忙扩散，今天上午一个三岁多小女孩在锦绣花园小区附近被人拐走了，小女孩能说出她爸爸的手机号码 从监控上看是被一个四十多岁男人抱走了现大人都急疯了 有知情者请告之 万分感谢 看到信息的兄弟姐妹留意一下 联系人宁继春13940292999 #宝贝回家#;@包子脸在看书 @变成学霸 @冇薄荷 亲们帮忙看一下，你们大连银;,2015/3/27 22:09,rumor
今天被偷了三个孩子，大润发也丢了两个孩子～有陌生人刚把孩子迷晕，幸好老师及时发现，偷孩子的两个人被抓了起来，现关在东华路派出所。这一次他们这个团伙派一百多人，专偷七岁以上孩子，是要人体器官，肾脏 各位父母，孩子贪玩莫一时大意，丢了孩子，请看管好自己的宝贝！发一发引起注意!年尾了                 ,是要注意;,2015/2/3 16:39,rumor
早安[新闻今天被偷了三个孩子，东莞厚街大润发也丢了两个孩子～有一个陌生人刚把孩子迷晕，幸好被老师及时发现，偷孩子的两个人被抓了起来，现关在东华路派出所。根据他们交代，这一次他们这个团伙派了一百多人，专偷七岁以上的孩子，是要人体 http,,2015/2/3 10:02,rumor
今天被偷了三个孩子，蚌埠大润发也丢了两个孩子～有一个陌生人刚把孩子迷晕，幸好被老师及时发现，偷孩子的两个人被抓了起来，现关在东华路派出所。根据他们交代，这一次他们这个团伙派了一百多人，专偷七岁以上的孩子，是要人体器官，肾脏什么提醒各位父母好恐怖阿！@陈士渠 是真是假，人心惶惶,http://t.cn/RwhSRn3;,2015/2/5 9:51,rumor
今天齐齐哈尔被偷了三个孩子，大润发也丢了两个孩子～有一个陌生人刚把孩子迷晕，幸好被老师及时发现，偷孩子的两个人被抓了起来，现关在东华路派出所。根据他们交代这一次他们这个团伙派了一百多人，专偷七岁以上的孩子是要人体器官肾脏什么的 在微信圈发一下提醒各位父母孩子贪玩时时关注玩耍去向。,,2015/1/28 21:59,rumor
今天被偷了三个孩子，大润发也丢了两个孩子～有一个陌生人刚把孩子迷晕，幸好被老师及时发现，偷孩子的两个人被抓了起来，现关在东华路派出所。专偷七岁以上的孩子，是要人体器官。 提醒各位父母，孩子贪玩，时时关注玩耍去向。莫一时大意，丢了孩子，请看管好自己的宝贝儿！年尾了家长多长心眼…🙏,妈的。狗日的人贩子。;太恐怖了 😱;回复@萌姐姐姐姐i:是的，;,2015/2/2 15:49,rumor
今天被偷了三个孩子，大润发也丢了两个孩子有一陌生人把孩子迷晕，幸好被老师发现，偷孩子的两个人被抓了起来，现关在东华路派出所根据他们交代，这一次他们这个团伙派了一百多人，专偷七岁以上的孩子，是要人体器官，肾脏什么的在这提醒各位父母，孩子贪玩，时时关注玩耍去向。莫一时大意，丢了孩子。                 ,,2015/2/1 17:07,rumor
今天齐齐哈尔被偷了三个孩子，大润发也丢了两个孩子～有一个陌生人刚把孩子迷晕，幸好被老师及时发现，偷孩子的两个人被抓了起来，现关在东华路派出所。根据他们交代，这一次他们这个团伙派了一百多人，专偷七岁以上的孩子，请看管好自己的宝贝儿！发一发引起注意!年尾了家长多长心眼…,,2015/1/30 23:21,rumor
今天河北被偷了三个孩子，白沟也丢了两个孩子～有一个陌生人刚把孩子迷晕，幸好被老师及时发现，偷孩子的两个人被抓了起来，现关在保定派出所。根据他们交代，这一次他们这个团伙派了一百多人，专偷七岁以上的孩子，是要人体器官，肾脏什么的。提醒各位父母，莫一时大意，丢了孩子，发一发引起注意!,说是假的，但是我也删除不了;,2015/1/29 22:14,rumor
今天廊坊被偷了三个孩子，东沽港也丢了两个孩子有一个陌生人刚把孩子迷晕，幸好被老师及时发现，偷孩子的两个人被抓了起来，根据他们交代，这一次他们这个团伙派了一百多人，专偷七岁以上的孩子，是要人体器官，肾脏什么的。提醒各位父母，请看管好自己的宝贝儿!年尾了家长多长心眼,转发微博;,2015/1/27 23:05,rumor
今廊坊被偷三个孩子，东沽港丢了两个孩～有一个陌生人刚把孩子迷晕，幸好被老师及时发现，偷孩子的两个人被抓了起来，现关在王庆坨派出所，这一次他们这个团伙派了一百多人，专偷七岁以上的孩子，是要人体器官，关注孩子玩耍去向。莫一时大意，丢了孩子，看管好孩子发一发引起注意 津淄公路,回复@茜妹妹q:现在这么多偷小孩的，怎么不造雷劈呀？可恨;年关将至，小心谨慎。;,2015/1/27 22:19,rumor
今天苏桥被偷了三个孩子，大留镇也丢了两个孩子～有一个陌生人刚把孩子迷晕，幸好被老师及时发现，偷孩子的两个人被抓了起来，现关在苏桥派出所。根据他们交代，这一次他们这个团伙派廊坊一百多人，专偷七岁以上的孩子，可能是要人体器官，比如肾脏什么的。 在微博发一下，提醒大家一下看好孩子！,谣言;太可怕了 着都什么社会啊;回复@新睿途来吧:真是。。这社会越来越可怕;,2015/1/27 21:29,rumor
今天东岭被偷了三个孩子，大汾乡也丢了两个孩子～有一个陌生人刚把孩子迷晕，幸好被老师及时发现，偷孩子的两个人被抓了起来，现关在东岭派出所。根据他们交代，这一次他们这个团伙派菏泽一百多人，专偷七岁以上的孩子，可能是要人体器官，比如肾脏什么的。,太恐怖了;,2015/1/20 22:36,rumor
国家对人贩子的处置太仁慈了！急找孩子，求转，河南省巩义市实验小，帮忙扩散，今天上午一个三岁多小女孩在锦绣花园小区被人拐走，小女孩能说出她爸爸的手机号码 从监控上看是被一个四十多岁男人抱走了现大人都急疯了 有知情者请告之 万分感谢 看到信息的兄弟姐妹留意一下 联系人 张静杰13759695559,此为虚假消息！此手机号码是陕西渭南的收费电话，拨打此号码会收取高额费用。请勿转发虚假消息！;转发微博;,2015/1/15 18:49,rumor
上海被偷了八个孩子，一个陌生人刚把孩子迷晕，幸好被老师发现，偷孩子的两个人被抓了起来，现关在宝山区署地派出所。根据他们交代，这一次他们这个团伙二百多人，专偷七岁以上的孩子，可能是要人体器官，比如肾脏什么的。 提醒各位父母，孩子贪玩，时时关注玩耍去向。暑假期间请看管好自己的宝贝儿,放暑假了，看管好自己的孩子！;,2014/7/11 5:20,rumor
这两个女婴是被人贩子带上火车，后被乘警发现解救下来的，请大家帮忙转发，帮助两个女婴寻找亲生父母。（只需动动手，孩子就多一个机会！）                 ,这不是很久的事了？;我没有在博文中涉及“领养和目前”等违规字样，以我根本没发过的内容作为处罚依据，简直是欲加之罪！站方判定：“此微博所称，这两个女婴是被人贩子带上火车，后被乘警发现解救下来的，目前在昆明附近安宁的一家医院中一事，实际发生于2012年7月3日，并非发生于目前，且打拐解救的孩子不支持领养。”;感谢转帖！//@深水地平线1: //@尚姐0082013:回复@挖挖视线:谢谢您的爱心！ //@挖挖视线:好可爱的宝宝//@尚姐0082013: //@热事辣评: //@王国富9: //@啊初步设计: 有谁丢了孩子注意了，互转啊 //@尚姐0082013: //@热事辣评: //@王国富9: //@啊初步设计: 有谁丢了孩子注意了，互转啊;,2014/2/19 14:04,rumor
这些人贩子都不是人。13947904333帮忙！ 求扩散，今天上午一个三岁多小女孩在温州华润超市附近被人拐走了，小女孩能准确说出她爸爸的手机号码，从监控上看是被一个四十多岁男人抱走了，现大人都急疯了，有知情者请告之，万分感谢！看到信息的兄弟姐妹留意一下！联系人郑春蓉13947904333,,2013/8/19 12:21,rumor
@0爱要怎样才完美 爆料： 昨天上午一个小女孩在大润发超市附近被人拐走了，小女孩三岁多，能准确说出她爸爸的手机号码，从监控上看是被一个四十多岁男人抱走了，现大人都急疯了，有知情者请告之，万分感谢！帮忙转发！ 抓住万恶的人贩子！                 ,可恶！;耍玩呢，欺骗我们的同情心，有意思吗，好歹也是面向公共微博;已经证实是假的了;,2013/7/17 22:02,rumor
转发的!希望可以快D稳返求扩散，今天上午我同学的同事的女儿在花都新华大润发超市附近被人拐走，小女孩三岁多能准确说出她爸爸的手机号码，这是我们同事女儿的照片，从监控上看是被一个四十多岁男人抱走，现大人都急疯了，有知情者请告之Ps：扑街人贩子，不得好死！                 ,刚听说这事是真的! 小孩也找到了!但不是在花都!好像信息内容一样!只改了地名!有够无聊的!但!也给了妈妈们一个警示!带 小朋友出去一定要小心;是的，上午就听朋友说找回了;回复@零下一度冰V:真的吗？;,2013/7/14 12:19,rumor
人贩子故意用刀子把他们的身体划的伤痕累累，从而换取不义之财，他们嫌刀子划的不够狠，还用硫酸烧孩子的身体，痛苦难忍的小女孩用稚嫩的童音哀求着：“叔叔求你别用硫酸了，还是用刀子割吧…”这帮畜生！拐卖妇女儿童应该直接枪毙，如果你不是人贩子你会转，同意转。                 ,;枪毙！！！！！！五马分尸！！！！凌迟处死！！！！！看谁还敢拐卖！！！！;;,2013/6/14 10:07,rumor
【今夜，三牌楼大街，亲身经历绑架事件！！！！】 PS：南京的姑娘都长点心了！！！现在人贩子太恐怖了！！！！via@宫小欣等等等等等等等 原帖地址：http,@阳光and沙滩and海;回复@傅泓皓-:勉强;回复@InKaMan:我勉强体会到个女仔当时崩溃的心;,2013/5/21 14:02,rumor
5.19日晚，南京三牌楼大街，南京网友亲身经历的绑架事件！南京的姑娘都长点心了！！！现在人贩子太恐怖了！！！！扩散周知！                 ,回覆@Oi_Yeee:这是中国公安，不是香港警察;回复@大笨瓜瓜:其实警察一査身份证，二来带回公安局核对资料，三来查户口簿，那就真相大白了。;回复@大笨瓜瓜:所以现在少出夜街，治安太不好的原因是现在太多办事不力的民警，令为非作歹的歹徒更加猖狂。;,2013/5/21 15:22,rumor
这两个女婴是被人贩子带上火车，后被乘警发现解救下来的，目前在昆明附近安宁的一家医院中，已经做过检查，身体健康，此微博有两个目的：1• 寻亲，请大家帮忙转发，帮助两个女婴寻找亲生父母。2• 如寻亲未果，寻领养。（只需动动手，孩子就多一个机会！）                 ,@马伊琍;这个是不实信息，PO主删除吧;[bm可爱];,2013/3/28 16:16,rumor
【谨防宝宝被拐】身边真实的事情，惊出我一身冷汗。天津阿姨家邻居带着3岁的儿子去超市，付账的片刻发现孩子不见了，立即找保安求助。保安很给力，马上对讲机通知关闭所有入口进行排查。最后找到了小孩，头发被剃了，衣服被换了。人贩子团伙太恐怖了，家长带小孩外出一定要非常谨慎。一定！！！                 ,为什么显示是，不实消息？;可怕！;有这种智慧干点什么正经事不好？！nnd;,2013/2/17 8:49,rumor
马连道家乐福发生突发事件，营业时间所有出入口用铁门封闭，不许进出。原因是一名女士在结账时跟在身边的孩子突然失踪，幸亏及时报警，家乐福立刻封闭所有出入口寻找孩子，后来孩子在二楼卫生间找到，头发被剃光，衣服已经被换掉，人贩子不知去向。年关将至，请大家出入公共场合务必带好孩子！！！,看好各家的千金少爷神马的吧，K//@我就是一女超人: 太恐怖了！真假？@马良GURI;这是什么世道，人怎么会变得这样？家长们务必提高警惕，带好孩子！;转发微博;,2013/1/8 13:53,rumor
【再次提醒：谨防宝宝被拐】天津阿姨家邻居带着3岁的儿子去超市，付账的片刻发现孩子不见了，立即找保安求助。保安很给力，马上对讲机通知关闭所有入口进行排查。最后找到了小孩，头发被剃了，衣服被换了。人贩子团伙太恐怖了，家长带小孩外出一定要非常谨慎，一定！！！！                 ,已经核实是虚假信息，这个所在地被天南海北的转了;@培正逗点松江中心;很无语的说- -都是N久前的谣言了~虽然可以起到提醒的作用，但是更多的是引起恐慌吧？;,2013/1/2 20:50,rumor
最近出现骗子让单独带孩子的家长帮忙照相，当家长拿着相机拍照的时候就会出现眩晕。然后孩子就被抱走了。沈阳出现两起了。请告诉周围妈妈们注意！ 深圳也有妈妈差点上当 转发让各位爸爸和妈妈们注意！人贩子要枪毙看谁贩！,,2013/1/1 18:12,rumor
#身边微提示#【 带孩子去超市注意啦！】哈尔滨太平家乐福：一名女士在结账时跟在身边的孩子突然失踪，及时报警，家乐福立刻封闭所有出入口寻找，后来在二楼卫生间找到孩子，头发被剃光，衣服已被换掉，人贩子不知去向，团伙作案手法迅速。Ps：年关至，大家出入公共场合务必带好孩子。请扩散！                 ,,2012/12/29 15:46,rumor
太平家乐福发生突发事件，营业时间所有出入口用铁门封闭，不许进不许出，一名女士在结账时跟在身边的孩子突然失踪，幸亏及时报警，商场立刻封闭所有出入口寻找孩子，后来孩子在二楼卫生间找到，头发被剃光衣服已经被换掉，人贩子不知去向，团伙作案手法迅速，年关将至请大家出入公共场合务必带好孩子,回复@鳗鱼S笑笑:就是，听起来都挺恐怖😱，还是小心为妙;介个，介个。。同一事件，不同地点，看了好几个版本了。但不管怎么样，带孩子出门一定要注意，注意，再注意。;确实有点恐怖！怀念老薄在的时候，重庆的治安是多么好啊;,2012/12/11 22:18,rumor
家乐福发生突发事件，营业时间所有出入口用铁门封闭，不许进出，原因是一女士在结账时跟在身边的孩子突然失踪，幸亏及时报警，家乐福立刻封闭所有出入口，后来孩子在二楼卫生间找到，头发被剃光，衣服被换掉，人贩子不知去向，团伙作案手法迅速，年关将至，请大家出入公共场合务必带好孩子。请转发,回复@LIJINBIN:;家乐福好苦逼。总感觉有一个团体在黑他;注意安全，年关了，小偷什么的都得搞钱过年了  //@华润置地-田磊:应急处理得当啊，大家要小心啊//@倔强小黄牛_:缺德啊？！要逆天啊？！过年缺钱把主意打到娃娃身上啊？！人渣，行事了切偷孕妇肚子头的娃娃嘛！死变态！！！[闪电][闪电][闪电];,2012/12/13 16:35,rumor
【年终了，请看好你的小孩！】年终到了，网传拐卖儿童的事件频发，令人揪心！不管真假，在此提醒朋友们，出门带小孩一定要格外小心，以免让人贩子有机可乘！请转发给身边有小孩的朋友！！                 ,像计生那样实行一票否决制，估计应该是最有效果的。 来自:http://t.cn/zj6UFC5;,2012/12/11 15:13,rumor
中国政府还有什么理由不严惩买方根源！太平虎门家乐福营业时间所有出入口用铁门封闭，原因是一名女士在结账时跟在身边的孩子突然失踪报警，家乐福立刻封闭所有出入口，孩子在二楼卫生间找到，头发被剃光衣服已被换，人贩子不知去向，团伙作案手法迅速@CDTV孔维薇 @玩艺术的布衣蔡健 @萱噜噜,被河蟹了，呵呵;回复@德新书生:原来是假消息;[可憐]严惩;,2012/12/13 13:48,rumor
带孩子逛超市要小心。。家乐福一名女士结账时孩子突然失踪，立刻报警，家乐福封闭所有出入口，后来孩子在卫生间找到，头发被剃光，衣服被换掉，人贩子不知去向，作案手法迅速。。这种手法两年前曾经在南海桂城城市广场易初莲花超市发生过，是身边认识的真人真事啊。。 @唔喺鼓佬--轩爷,平时带小朋友出街真係要好小心注意了…;回复@Bro_Wuji:有些人，道德尽失，信仰全无。。;这世道;,2012/12/11 11:31,rumor
今天【昆山家乐福】上午营业时间所有出入口用铁门封闭，不许进不许出，原因是一名女士在结账时跟在身边的孩子突然失踪，幸亏及时报警，家乐福立刻封闭所有出入口寻找孩子，后来在二楼卫生间找到，头发被剃光衣服已经被换掉，人贩子不知去向团伙作案手法迅速，年关将至请大家出入公共场合务必带好孩子。,,2012/12/12 13:49,rumor
东莞虎门太平家乐福发生突发事件，营业时间所有出入口用铁门封闭，不许进出，原因是一名女士在结账时跟在身边的孩子突然失踪，幸亏及时报警，立刻封闭所有出入口寻找孩子，后来孩子在二楼卫生间找到，头发被剃光，衣服已经被换掉，人贩子不知去向，年关将至，带好孩子！@逗逗0608,回复@骤晴骤雨:问题是谁在散播。;虎门太平有条囵家乐福啊！;,2012/12/11 13:38,rumor
【抓人贩子！】公安部A级通缉令缉拿10名拐卖儿童妇女逃犯(左起)：余昌海、王细灵、陈莲香、陈小东、安金良。下排左起：赵超超、熊建桥、刘秀清、彭家宝、化明。现在逃。对发现线索的举报人、缉捕有功的单位或个人，每抓获一名将给予人民币5万元奖励。请大家帮忙转发出去！！！                 ,转起来！;真的不实吗？//@老曲老曲: 抓//@青春榜样-全国农村创业青年典型:必须都抓起来，关到死，让他们偷孩子;//@南京有有: //@hz曾永乐:;,2012/12/5 14:26,rumor
