"#善恶到头终有报# 杭州在不停止这种惨无人道的杀业报应马上就会到！！！做为中国人出国都抬不起头感觉就是种侮辱，生而为人，劝你们善良，学学强国是如何对待流浪动物的，看看中国，无一例外，都是当街！！活活打死！！@杭州余杭城管  @余杭公安  @中国政府网  @国防部发布  @杭州城管  @平安杭州  @杭州发布  文明需要进步而不是倒退，你们不应该出台禁止养犬条例，应该出台允许养犬条例，马路上流浪狗基本都是被没人性的前主人遗弃的中华田！这明明就是人的错！！中国法律不出台惩罚狗主人条例！！！非要对无辜的狗狗下手！！！简直无耻至极！！！我们呼吁动保立法呼吁出台《反对虐待动物法》宣传领养代替购买绝育代替捕杀抵制动物黑色产业链，禁食猫狗肉反对虐待、反对杀虐提倡文明养犬坚决反对残暴执法行为[加油]关爱动物，尊重生命忍住！别掉泪！2018.11.13杭州朝阳逸景苑视频禁止上传，动图像素原因，不清晰，但是这就是杭州--所谓的""天堂""。看不清视频中穿着制服的是城管，还是小区保安，打狗者身着便服，无论是谁、是否隶属于哪一个部门或是怎样，我问问你们！谁给你们的权力！当街杀狗？！旁人的尖叫，你们充耳不闻？！若小黑狗，有主有证，你是谁？凭什么？如果是未遵循""文明养犬""，是城管更不该如此执法！犬主责任，为何落到犬只身上！你家的狗会自己带牵引吗？是保安？是狗贩？那就问问杭州为何可以光天化日掠夺性命！还是说在杭州，无主无证的处理方式就是棒杀？杭州办犬证条件苛刻、强制规定遛狗时间、中华田园犬被归于烈性犬被禁养！甚至禁养犬种的繁衍犬，都是被禁养！合理吗？世界首创的奇葩遛狗时间，犬在这个与国际接轨的""天堂""，成为夜行动物。《杭州限制养犬条例》规定中，只有对狗的约束，丝毫未见一条是维护犬的生存权益的。犬主缴纳的费用，是为了用于给所养犬只取得合法身份，既然是合法就享有合法的权益，那么，杭州的犬只有哪方面合法权益可以受到保障？这些钱又是否真正用于狗的福利和保护上？一系列的犬证费用，管理费用，连最起码的犬证芯片都没有！请问杭州市城管局，是如何火眼金睛区分游走在街上的犬只是否办证？杭州市12345市长公开电话接线员，口口声声称犬主会去收容所寻找，请问，连芯片都没有的狗，城管如何联系到犬主？犬主如何到收容所接回犬只？接线员对于收容所位置、收容天数，再三推诿，含糊其辞，普通市民哪里来这么多电话打？除了这个电话，我们还可以像哪里开口诉说我们的委屈？全部推脱、微博禁上、视频功能被封等等等等... ...你们以为这样，恶行和滞后的条例就不会被世人知晓吗？杭州，除了抓，就是罚，要不就是杀，作为犬类管理，应该做点有『理』的举措？从源头管控犬患，长效治理而不是一刀切杀！将中华田园犬归于烈性犬的依据又是什么？众所周知田园犬属于中国本土犬种，是国犬，来自中国！而禁养和限养中却莫须有罪名强制被冠以烈性犬？要知道中华田园犬在国外性情温顺犬比赛中排名第四，怎么到了杭州就变成烈性了，那么，法律依据是什么？城管就最近热点问题召开记者新闻会（取消了之前的直接捕杀，直接没收等强硬执法方式，代之为暂扣，情节严重者没收的文明执法方式），这是值得",别现在道德制高点绑架别人，流浪狗绝大多数可能携带狂犬病，且，你能保证它不会攻击居民，要是有居民被咬伤？你们这样圣母出钱治疗？狂犬病致死你们赔偿？;,2018/11/15 5:17,rumor
文明执法？这就是你们的文明执法？一下又一下，为什么要如此残忍。明明已经没有反抗之力了，为什么要这么决绝？它们也是一条生命，它们也有生存的权利，狗狗被人类驯化于1.5万年前，至今陪伴了多少人度过了童年？又救过多少人于水深火热之中？它们没有发言权，难道它们连生存的权利也没有么？这发生在哪？        这发生在杭州，浙江省省会、中国一线城市、长江三角洲城市群中心城市、环杭州湾大湾区核心城市、杭州都市圈核心城市、沪嘉杭G60科创走廊中心城市、国际重要的电子商务中心，就是这么一个头衔众多的国际化大都市，竟然连它们生存的权利都要剥夺。这么一个一线大都市，连狗狗的生存空间都没有，即使你们要治理要整治，为何要用这么残忍的手段？人性何在？善良何在？文明又何在？口口声声文明执法，缺不断流出血腥，暴力的过程。这是看到的，那么我们看不到的时候呢？那恐怕更血腥，更暴力吧？@交通918徐琳  @交通918小麦  @杭州猫狗电台  @杭州交通918  @杭宠小哥哥  @爱宠物部落  @宠物领养  @宠物互助杭州站  @杭州宠物救助会  @杭州动物保护志愿者团队  @杭州iTA动保团队  @猫神传奇张先生  @陶十二  @乡村教师代言人-马云  @文艺泽  @1818黄金眼  @浙传流浪动物之家  @杭州发布  @央视新闻  @杭州城管,这是流浪狗吗？;你还要发哈哈哈哈;我已经查清，这根本就不是执法，请原博停止造谣;,2018/11/14 0:32,rumor
#杭州血腥打狗# @杭州城管@杭州城管 @杭州城管  不要装聋作哑了，做这样的事情不怕伤阴德吗,@杭州城管 @杭州 你们这么做事的吗？生而为人 没有人性？你们不得好死，下地狱去吧，下辈子投胎也是畜牲，问候你们全家;这就是杭州的文明治安？ 真棒！ 这么棒的对待希望下次降临在你们身上;好像不是网上说的城管打的。 评论配图;,2018/11/13 22:30,rumor
#杭州城管杀狗#这是杭州今天打的狗，大部分已经死了，还有看着遍地尸体的嗷嗷叫的奶狗，麻袋里还有狗在捶死挣扎。恳请大家投诉电话打起来！057112345 http,为什么洗白说是假的微博杭州本地人难道是假的吗那些视频假的吗那些为狗发声的杭州本地人难道是假的吗;看到不实的时候就能知道多血腥多暴力，要隐藏什么！;此生不会去杭州;,2018/11/10 23:23,rumor
【地狱空荡荡，魔鬼在人间】8月13日，广东东莞城管一拳打晕死女摊主，城管打人之后还恐吓她女儿说“跪在这里哭，你知道吗，你媽媽死啦” http,权力无论大小，有权就来欺下权力的付予者人民！而人民只能顺受，但这种顺受是有限度!;从小埋下了对“执法人员”仇恨的种子;回复@2011此情可待成追忆:保安;,2018/8/17 20:38,rumor
心中升起莫名的恨，禽兽穿戴衣冠的时候更加显露禽兽的本性！8月13日，广东东莞城管一拳打晕女摊主，城管打人之后还恐吓她女儿说“跪在这里哭，你知道吗，你妈死啦”！ http,众筹杀了他;是真的话，这货真不该活到明天。;我这有视频！城管可耻;,2018/8/17 20:45,rumor
@衡阳发布 @衡阳吃瓜兔子 这是衡阳城管？视频中 城管先动手 迷路的大魔王啊的微博视频,回复@雁城雄鹰81:保安被锅;人家雁峰区公安局通稿都出来了，保安打人被拘留5天;@文明湖南  这就是衡阳城管执法？好意思评选文明城市@今日衡阳  @衡阳城管  @衡阳身边事  @衡阳市公安局  请依法惩处;,2017/9/19 11:04,rumor
济南城管打人！哪来的底气这样执法？！ 觉皇莫莫的秒拍视频,@微博客服  麻烦帮忙删掉此条微博，谢谢;他这么想红 就帮帮他吧;断章取义 打人不对 商贩还有理了？;,2017/8/23 23:01,rumor
四棍子下去，一条人命就没了，城管特勤遭报复，上班玩手机被打死🙏 http,回复@PHUANG2013:死了就好，没死有点可惜…;回复@痴迷画笔:可惜呀，没打死…;回复@史海撷英:没死;,2017/5/10 3:20,rumor
#新闻之爆料人# 城管为什么被杀？答案在这里 http,气愤！人性都被泯灭了吗？中国泱泱五千年的大国，号称礼仪之邦，有这些人真丢人。;气愤！人性都被泯灭了吗？中国泱泱五千年的大国，号称礼仪之邦，有这些人真丢人。;没死吧;,2016/7/30 23:02,rumor
#老谈说事# 城管被杀的整个过程！  http,老百姓已经被城管逼的死都不怕了。;赞;好好好;,2016/7/28 16:13,rumor
#上海城管把商家打死#上海城管把学弟的亲舅妈打死！发生在学弟身上的真事！希望社会还个公道！,听他扯;啥呀 上海城管都没暴力执法过 咋一下子这么大一张锅;真的假的？;,2016/6/10 21:22,rumor
上海市闵行区颛桥镇沪闵路向阳路，辛苦农民摆摊卖菜，恶意城管不分青红皂白掀摊打人致死，事后逃逸，120医生到场宣布死亡，家人痛苦万分，只求大家帮忙转发🙏🙏🙏…（尤其上海的朋友）早日将黑心打人者绳之以法！！！,人在做天在看，不要以身试法，试图撞死市容管理人员，没想到撞死自己老娘;回复@期待油菜花开:笑死，你也快把你爹妈带上海来啊，一脚油门问ZF要钱吧，下辈子吃喝玩乐不愁，哈哈;明明是那男的自己要撞城管 结果把自己妈给撞死了 呵呵 现在倒反过来倒打一耙了 没看见就别乱传谣言;,2016/6/9 20:42,rumor
上海闵行区，颛桥，城管打死人了，你们媒体都瞎了吗，搞笑，，，就知道报告表面的//【生态红线今年全面收严 金山未来要建国家级海洋公园】  金山未来要建国家级海洋公园                 ,图片评论 评论配图;,2016/6/10 22:13,rumor
上海颛桥城管暴力执法之人，死亡　没天理了,,2016/6/11 21:33,rumor
视频：上海市颛桥城管打死人了，求全国转发，求个工道。 http,把自己亲妈撞死怪国家怪政府咯？;//@安阳黑: 转发微博;我转载@苏远洪04939的@微博管理员 @微博小秘书;,2016/6/11 20:16,rumor
上海市闵行区颛桥镇城管队因暴力执法致平民百姓黄维蓉死亡事件目前在持续发酵中，上海新闻前天到现在采访过以后但是并未有任何报道，可能是管管相位，都不敢报道。大家可以相互转发，真人真事。城管车上带有大量钢管木棍等暴力执法工具，野蛮至极。,回复@麵粉_Gyve:这个说实话  我当时也不在  因为是我们家里人  肯定会想当然的  相信家里人的说法 后面清楚了  也就不这么  气氛了;我朋友当时在现场…确实是肇事者自己抗法开车想撞城管结果车子带到他妈…撞没什么，主要是倒下时候头撞地了…拖全村来闹事我也是醉了…;回复@跑椭圆机的人:别地域黑好吗.你说安徽人耍无赖我能不能说你们那边的人都是智障！;,2016/6/10 18:22,rumor
广西南宁鸡村強拆，奔驰老板跟儿子被活活打死，他的死让我明白了这就是中國，我能做的也只有转发，让更多的人看到，走好，你是条汉子。城管也有2死，几个受伤。老爸先在自家楼顶被打死后儿子开车撞上几个城管后开车的是儿子也被打死了。希望新闻媒体尽到应有的责任，还事实一个真相，不要遮遮掩掩的,,2015/8/30 7:51,rumor
广西南宁鸡村強拆，奔驰老板跟儿子被活活打死，他的死让我明白了这就是中國，我能做的也只有转发，让更多的人看到，走好，你是条汉子。城管也有2死，几个受伤。老爸先在自家楼顶被打死后儿子开车撞上几个城管后开车的是儿子也被打死了。两命换两命。现在连家人还被派出所关着呢。希望新闻媒体尽到应有,,2015/9/1 15:41,rumor
南宁鸡村父子开多年宾馆。城管，黑衣强行拆迁，父亲被打死，儿子开奔驰撞黑衣，最终斗不过挖掘机，下车被几十黑衣活活打死！有关视频全部被封锁消息，比土匪还土匪！做鬼去杀他们吧～要是当时群众反抗、就不会冤死了，心痛啊！,？;？;恐怖;,2015/9/6 21:59,rumor
8月28日广西南宁鸡村強拆，奔驰老板跟儿子被活活打死，城管也有2死，几个受伤。老爸先在自家楼顶被打死后儿子开车撞上几个城管后开车的是儿子也被打死了。现在连家人还被派出所关着呢。希望社会关注..,为什么标志不真实！！！！！qq空间在狂转！我都不敢看下去！！！！！太心寒了！！！那这件事是不是真实存在！！！！！是什么才会把一个有房有奔驰的人逼上这条路！！！！！政府到底是怎么安排的，非要强拆，两败俱伤，伤民心，伤政府声誉;尤其城管拉去活烧！;把南宁市所以当官的全都拉去杀了！;,2015/9/11 6:54,rumor
广西南宁鸡村強拆，奔驰老板跟儿子被活活打死，这就是中國，我能做的也只有转发，让更多的人看到，走好，你是条汉子。城管也有2死，几个受伤。老爸先在自家楼顶被打死，儿子恼火开车撞城管！奔驰最终干不过挖掘机，儿子也被城管打死了。两命换两命。。。 中山·小榄镇,回复@TIMES801:原来你跟你妈是乱伦啊？ 😱原谅我有眼不识泰山，受教了。本姑娘的妈妈回来了，不用你担心了。;回复@用户5092111500:是吗，一般都是先清除你妈和你这样愚蠢的乱伦行为先吧;回复@KedaYInGi柯颖:视频我都看过了，朋友圈上也很多人转;,2015/8/31 21:32,rumor
南宁强拆现场上演“特色”而震撼的一幕，户主开奔驰撞击城管，被挖掘机一击凿停 http,有很多事是当地政府默许的。因为买地收入是政府财政的血管。他是在吸百姓的血。我们团结起来把吸血鬼赶走。;回复@Mr_uns:吃屎狗！五毛拿去给你治癌症;回复@Mr_uns:你是二狗子?有胆出来，我在鸡村等着，光脚不怕穿鞋的。;,2015/9/1 0:01,rumor
广西南宁鸡村強拆，奔驰老板跟儿子被活活打死，他的死让我明白了这就是中國，城管也有2死，几个受伤。老爸先在自家楼顶被打死后，儿子开车撞上几个城管后被拦截也被打死了。两命换两命。现在连家人还被派出所关着呢。希望新闻媒体尽到应有的责任，还事实一个真相，不要遮遮掩掩的 秒拍视频,难道录像会造假吗？;你们都太天真了 哪个拆迁滴不带几十个打砸滴      中国因为强买强拆打死滴老百姓还少吗 我只想说 有你妈本事去打那些贪官奸商去 或者去打钓鱼岛也可以 欺负老百姓或许就是我们中国人滴本事吧 要是换成打死我爸 我会买炸药炸死那些狗和奸商还有在背后给他们撑腰滴狗官  都尼玛去死吧;@蒋欣;,2015/9/1 5:32,rumor
广西南宁鸡村強拆，奔驰老板跟儿子被活活打死，城管也有2死，几个受伤。老爸先在自家楼顶被打死后儿子开车撞上几个城管后儿子也被打死了。两命换两命。现在连家人还被派出所关着呢。希望新闻媒体尽到应有的责任还事实一个真相，不要遮遮掩掩的就算违建也不能这么暴力执法。这么大栋楼违建时没人看见吗,网传公文为何说无人死亡？;,2015/8/31 1:27,rumor
#奔驰闯拆迁现场撞人# [xkl顶]实情[xkl顶]南宁市大鸡村，强拆博白佬的宾馆，打了博白佬的爹娘，然后博白佬开奔驰撞飞4个，当场死两 ，然后开奔驰的博白佬和他爸当场被拆迁办的几十打手拿砖头活活砸死 。几十上百人打一个已被控制手无寸铁的人！中国城管真棒哟！！,没人死啊？;,2015/8/29 18:08,rumor
#南宁鸡村强拆# 广西南宁鸡村強拆，奔驰老板跟儿子被活活打死，老爸先在自家楼顶被打死后儿子开车撞上几个城管后开车的是儿子也被打死了。希望新闻媒体尽到应有的责任，还事实一个真相，不要遮遮掩掩的。就算违建也不能这么暴力执法。这么大栋楼违建时没人看见吗？相关负责人呢？ 南宁·宾州镇,回复@刘先莹_:被打脸了吗？！弱智;回复@matina20011:我没脑 你有脑 但起码我知道不能乱传谣言 谢谢;回复@刘先莹_NINa:艹你有脑吗？！;,2015/8/31 8:59,rumor
广西南宁鸡村強拆，奔驰老板跟儿子被活活打死，城管也有2死，几个受伤。老爸先在自家楼顶被打死后儿子开车撞上几个城管后开车的是儿子也被打死了。@八桂直播 为什么没见有记者曝光？ 秒拍视频 .,昨天在朋友圈看到的，这是发生了什么@人民日报  @中国青年报  南宁梁村;现在共产党跟以前日本没有什么区别;现在共产党跟以前日本没有什么区别;,2015/8/30 15:31,rumor
这是发生在广西南宁的城中村！城管执法强拆打死了居民！老人！谁给你们这种权利！打死人家父母！[发怒]中国城管！你他妈是军队吗？谁给你暴力执法的权利！[发怒]求转发！广西已经封锁了这个事情！很多人都不知道！一群城管把平民百姓打到不动了！才停手！导致四死一重伤！                 ,事发地点就在我公司附近，当时伤者被打到不动弹，医院抢救结果我们并不知道，大家都说死了，我才发微博的，后面知道抢救了没有死也在微博评论中说明！打人本来就是确实的事情！不可能因为人没有死，这些过失就不算了！太可笑了！;现在近一步了解到被打奔驰车主并没有死，受重伤、城管跟国土局的人也有几个受重伤;回复@加藤威威威威威威威威:看到了;,2015/8/29 11:08,rumor
#天津塘沽大爆炸#看到一篇文章，真心不愿相信，红十字会联合城管抢物资?如果真实，真应该炸你全家，太愤怒了……,回复@老--牛:你全家都是废物  蛐蛐;回复@沈小寂:看你这张脸就不会去做志愿者;我也不希望是真的  如果是真的  太可耻了;,2015/8/16 19:23,rumor
#天津滨海爆炸#红十会和城管绝B的不要脸了，竟然当场扣押个人的捐款物资，充公了，说是他们的了，说如果拿走就算偷，那些好心志愿者特别悲痛，我想说红十会和城管你们是魔鬼吗？为什么大家讨厌你们，为什么不捐款给你们，你们不反思改过，竟然变本加厉，我想说你们是国家的毒瘤！,被举报，劳资也是醉了;已经有开发区记者辟谣了，甭用您添乱;拍视频上传，大家会支持你的;,2015/8/17 10:00,rumor
一位爆炸后凌晨赶到天津滨海的北京志愿者说：“现场所有物资都是我们买来的，用自己的车运来的，现在红十字会和城管要联合执法，抢走我们的物资纳入红十字会名下，强行算作我们捐给红十字会。”#天津塘沽大爆炸# http,你举报，我截屏，照样可以发;太寒心了！！！;政府这次太让人寒心了，小胳膊拧不过大腿;,2015/8/16 9:25,rumor
我们在一线，不顾生死，不知疲倦，第一时间出资出力，城管在哪里？现在领导来检查，抢我物资，拆我帐篷，打我志愿者，人性何在，天理不容。天津万众势必维权到底。@介似天津卫 @奏耐天津,造谣为啥没销号？【网传城管队员抢东西 实为帮助志愿者搬运物品】http://t.cn/Ry2oUjI%A;这是李总理即将到来之前的事;哪里不实了？我朋友在塘沽做自愿者的也亲身经历，也是这么说的;,2015/8/16 8:32,rumor
“现场所有物资都是我们买来的，用自己的车运来的，现在红十字会和城管要联合执法，抢走我们的物资纳入红十字会名下，强行算作我们捐给红十字会的。” 天津爆炸惊魂：3天后，3公里内,此内容违规。。;不信。;言语无法形容的无耻。;,2015/8/16 9:09,rumor
为什么城管把物资都给抢了  城管这时候又牛逼了？很多一线的志愿者反映 一线的战士根本没有接受到物资 请问这些天大家送的物资都去哪了？ @奏耐天津  现在物资的去向清楚么？,,2015/8/15 18:43,rumor
#大嘴说事#天津红十字好威武天津城管好牛B马拉个币                 ,回复@太空堡垒自由号:;根据@头条新闻 【风暴眼：武长顺涉案74亿，中国贪官直逼百亿大关？】天津原公安局长武长顺涉案金额74亿令人震惊。#大嘴说事# 一个伍长顺就已经足够本次损失的赔偿了，还需要市民捐款捐物吗？？大家不要自做多情了！;回复@好物大王:;,2015/8/16 9:32,rumor
在微信看到有人发图 说：“城管和红十字会抢物资” 还觉得不明真相 红十字会现在连基本的体面都不要了！ 天津爆炸惊魂：3天后，3公里内,,2015/8/16 6:06,rumor
现场所有物资都是我们买的，用自己的车运来，现在红十字会和城管要联合执法，抢走我们的物资纳入红十字会名下，强行算作我们捐给红十字会。这些东西是我们的，按说我们可以把东西搬走，但是他们不让，说如果我们强行搬走，就是偷，偷物资。 天津爆炸惊魂：3天后，3公里内,既然你们觉得不对，干嘛不点赞啊？;可恶的城管;,2015/8/16 9:02,rumor
又是临武县出大事了！去年也是这个时候，曾经轰动全世界的临武城管用称坨打死瓜农。这一切的一切太让人恐惧！家长们一定要注意孩子们的安全！这个中国怎么了？那么多坏人！不要求你,,2015/6/24 21:52,rumor
网曝：宁夏中卫市南环路中山街口，城管将数千元草莓倒在地上，市城管局和公安局正在调查。微评：果农进城可以减少流通环节，让市民吃到便宜水果，只是没有经过几道批发零售商的转手，有关部门收不到税。从各地发生的群体性事件能够看出，官吏的贪腐，城管的恶行是造成社会动乱的罪魁祸首。                 ,,2015/4/20 18:25,rumor
城管与果农发生冲突，将数千元草莓倒在地上 - 宁夏中卫市南环路中山街口，城管与果农发生冲突，将数千元草莓倒在地上 http,为什么每次都激化矛盾呢？他们是你的管理对象，不是你的敌人！换个方式管理，效果大不同！;,2015/4/19 20:01,rumor
【日本鬼子又进村了】网友曝料：宁夏中卫市南环路中山街口，城管将数千元草莓倒在地上。农民的血汗钱啊，还有可怜的草莓。,,2015/4/25 17:54,rumor
【日本鬼子又进村了】网友曝料：宁夏中卫市南环路中山街口，城管将数千元草莓倒在地上的事件，中卫市城市管理局正在调查，公安局也以介入调查，请广大网民等待最终调查结果。,;#吖旺传播#;转发微博;,2015/4/20 9:55,rumor
【砸死瓜农城管免职又升官，现任法院副院长】网友称：砸死瓜农后，城管邹红卫遭免职，现官升至法院副院长，带领五名法官街头开展《国家赔偿法》宣传活动。记者昨日致电临武县法院，工作人员称“不接受采访”即挂断电话；临武县委宣传部则称，“不太清楚”。——有一个国家，打死人是竟然可以升官的！,"回复@韩渊论谈:你这智商不用吓我，留着吓自己吧;回复@小张同志的围脖:让一个曾经领导手下人非法剥夺与任性终止他人生命,双手粘满弱势群体鲜血的屠夫,主宰着司法生杀大权，难道你就不怕厄运有一天会降临到你的头上？;回复@湖南平江杨野:不知何为挂职？邹红卫究竟是不是当时打死瓜农时的城管领导？如果是，那究竟该不该承担责任？如果不是，那所谓的挂职就是在干着欺骗党和国家人民，欺骗习总王书，欺天瞒地破坏依法治国国策，实行反人类罪恶勾当。然而它却依然坐上司法主宰，去继续着那个还没有结束的故事,就是以权任性非法终止他人生命;",2015/3/19 22:48,rumor
近日，国内一些网站上出现让人震惊的图片。河北一名16岁高二的女学生赵子娇，惨遭当地城管队员毁容。至今毁容城管队员，没有受到任何处罚。惨不忍睹！。。。河北省16岁女学生惨遭城管毁容！！！这就是中国！！！,回复@你就不要想起我Jr:我下巴都惊呆了 我膝盖都从床上掉下去找下巴了;回复@鹿与长安:帅气的人都在写作业;回复@你就不要想起我Jr:漂亮的人都在看小说;,2015/2/5 21:26,rumor
街头杀狗找城管12319市场杀狗找工商12315狗肉馆找食药监12331 收狗站屠宰场找工商12315只有畜禽执照！非法超范围经营猫狗兽类食用！非法运狗车拦截找110交警！检疫证明非法，问责找市政府12345纪检010-12388 警监 12389 市场杀狗找工商12315,,2015/2/3 16:12,rumor
【爆料：@MC走音】 今天下午4点左右浙江杭州萧山区开发区建设4路与市心北路口， 城管执法，拉走一卖橙吉的小贩车，倒车时，不幸的撞死小贩4岁左右的小孩子。后家属情绪激烈跟特警打起来了 特警出动都有上百号了。,有监控的还能这么睁眼说瞎话;;视频不是很清楚了吗;,2015/1/17 11:40,rumor
