重庆一妇女，辛苦拉址三 个小孩，为了给孩子买点肉 吃，为交学费去卖山竹， 命送城管之手！ 《你不转，会脏了你的心 对吗？如果有良心，痛恨 请转发！没良心的就算 了.你就会懂的很多.....》 郑州·北环路南阳路公交站                 ,图片评论 评论配图;他妈的，只是摔伤？！尼玛一个个的滚蛋！！！禽兽不如;目前周老虎的残余势力在反扑。此案不纠正，不平反，反腐纯粹是清除异已;,2014/12/21 21:17,rumor
就在今天下午杭州萧山地区数名城管对卖贩下手，可是下手的是一名男性儿童，导致当场死亡，各位有爱的同志接力下去，一定要曝光这些人，让他们为自己做的一切承担责任@龙港百事通 @赶海的姑娘,不会吧;,2015/1/15 19:28,rumor
【13年7月砸死瓜农城管升官，现任法院副院长】网曝：砸死瓜农后，城管邹红卫遭免职，现官升至法院副院长，带领五名法官街头开展《国家赔偿法》宣传活动。记者致电临武县法院，工作人员称“不接受采访”挂断电话；临武县委宣传部则称：不太清楚。。。呵呵，，这就是我们国家的现实，可你又能奈何？？！,//@最高通俗爱: //@閩南龍夫://@梦郎有话说://@贺金云-:带病晋升——花了多少钱把组织搞定了？;//@社会罗宾汉: //@乌托之帮:转发微博;假的！莫乱造谣！时间地点人物事件原因五W不全，打脸！;,2015/1/14 18:16,rumor
<老人为了保护自已的泥土房被强拆，他挡在挖机前>城管说你不走，就碾死你。结果,真相是这样子的吗？请发文者不要混淆视听误导大众。;操他娘的，又是城管;这是真的吗！好残忍，怎么这样没人性呢！;,2014/12/13 22:45,rumor
分享图片昨天云南省大理州永平县县城某街发生城管暴力执法@央视新闻 @春城晚报 @今日微博头条 @8099999 @都市条形码,回复@永平县城市管理综合行政执法局:此消息由于本人疏忽 未经核实盲目转发 对造成的影响深深道歉;回复@诺邓古镇:此微博 由于我个人未经核实给转发 对此做出道歉;回复@永平一只脚:没核实sorry;,2014/11/3 9:27,rumor
刚到地铁看到这一幕！好心酸！人家就为了讨口饭吃至于你们下这么狠的毒手么.该死的城管，良心被狗吃了么[发怒][发怒] 天通苑,北京的城管也这样暴力了？;,2014/8/26 21:43,rumor
这条他们删帖了@平安北京  今天傍晚19点左右，有网友在北京国贸地铁口看到城管殴打小贩，场面十分惨烈，小贩被打的满地鲜血！后来警察到场，现场目击的一个女孩在向警察描述事件过程，而城管已经大摇大摆离去！ 扩散！！！@央视爆料,,2014/8/27 7:00,rumor
联合国排名世界各国国民素质，中国人民在168个国家中继续保持倒数第二。作为自尊的中国人，我被气得够呛。但昨天看了新闻，又稍觉庆幸：幸亏联合国的评选，发生在昨天乘客打砸深圳机场之前，否则就跃居倒数第一了都说中国城管威武，我咋觉得中国乘客都是城管的亲戚？@海峡都市报 @张天蔚 @东南快报,,2014/4/1 19:28,rumor
平时在广场配枪正常执勤警察叔叔们，人民需要你的时候，第一时间你在哪里?你的＂枪＂在哪里?区区十几个拿着原始作案工具的暴徒竞然能长时间如入无人之境，造成如此大的死伤！进行毫无人性的屠杀!还有高大威猛的＂城管综合执法防暴队＂你们又在哪里?下面是11名罪犯                 ,就是！;;//@古陶瓷收藏交流中心: 这些人该死;,2014/3/2 10:43,rumor
【我大国天朝的城管】河南一妇女为了给孩子凑钱治病，上街卖盗版CD，被城管发现后逃跑，CD被缴后跳入冰冷的水中躲避，城管还不肯放过她，要她把非法所得也交出来，她百般向城管哀求，这是孩子的救命钱，城管丝毫不为所动，不交钱就不许上岸，致使妇女在水中冻了两个小时，最后昏死过去。转                 ,//@独裁统治的秘密: //@李大华V: //@山东临沂孔大华://@胡锦亮伸冤: 人人冷漠，自私，邪恶，无爱心便是今日劫数之源！;http://t.cn/zj1ykWs;//@爱玛乐大象酒: //@休谟的微博://@初八大法师: 这世道，不杀掉这些畜生，行吗！！！;,2013/12/22 20:53,rumor
如果你在街上看到城管暴力执法的话，不用怕，你可以上前理论，城管局有明显的条例，是绝对不可以血腥暴力执法的！城管很怕这些东西！如果对方坚持，你可以拍下来或者打投诉电话！而且现在卖狗肉违法了！ 国家食品药品监督局11月1日开始集中受理狗肉馆举报，举报电话：12331 ．大家扩散出去！                 ,"回复@-温稳行: 我也想举报他;回复@IM_AUBREE:当看不见就好啦 哈哈 别跟连狗都不如的人计较;回复@-温稳行:累的不是我,惨的是狗;",2013/12/9 11:44,rumor
"惠州城管将女小贩扒下了裤子,打致昏迷！ （分享自 @凯迪网络） http",,2013/10/7 10:42,rumor
封建专制时代，大家都避讳“莫谈国事”。不是不谈，是莫谈。一来：这国不是你的，你谈什么谈！二来是：不敢谈…近日，看了一则“惠州城管执法时把女贩的裤子扒下”，实在忍不住爆粗口！“城管执法把女贩的裤子扒下”——是“执法扒裤子”么？！——人手齐抓共扒女贩的裤子是工作需要还是干什么？！,单身人的来由：原来是喜欢一个人；现在是喜欢一个人 >>http://t.cn/zRy5wbz @活色生香xs;,2013/10/2 12:46,rumor
「旧帖新读」＂城管，谁让你这么干的？＂！（@倪方六）日前惠州城管在执法时把女贩的裤子扒下（见图），据说打至昏迷。对与小贩的冲突，城管对媒体解释，女贩拿剪刀刺伤城管。那么多男人对付一个女人，人家不刺你才怪呢。                 ,转发;;有什么必要扒衣服，执法的真可怕，畜生;,2013/9/26 18:51,rumor
伤城管人员违法、但不知道城管合力扒女小贩裤子违法不、电影里鬼子是这样干的！惠州城管和小贩冲突，女小贩拿剪刀刺伤城管，城管先占领了舆论高地，着重强调城管队员被刺伤，媒体就是不提女小贩被扒下了裤子，被打昏迷。惠州小贩刺城管3剪刀后昏迷【高清组图】                 ,,2013/7/8 12:48,rumor
#草尼马这帮人渣# 惠州城管和小贩冲突，女小贩拿剪刀刺伤城管，城管先占领了舆论高地，着重强调城管队员被刺伤，媒体就是不提女小贩被扒下了裤子，被打昏迷。网页链接@中国之声 @东方早报 @这里是美国                 ,这个小贩本来就是男的，却给改了性别，再者，制服一个手持凶器的凶手的过程中，是不是还要细心保护好他的裤子，不要让它掉下来？;,2013/7/6 15:12,rumor
惠州城管和小贩冲突，女小贩拿剪刀刺伤城管，城管先占领了舆论高地，着重强调城管队员被刺伤，媒体就是不提女小贩被扒下了裤子，被打昏迷。惠州小贩刺城管3剪刀后昏迷【高清组图】 我在,,2013/7/7 8:46,rumor
「中青政治学院教授：杨支柱」惠州城管在执法时把女贩的裤子当众扒下的照片在网上流传，网民非常愤怒。计生扒下的女人裤子可比城管多几亿条，却很少有人关注。据说城管也有不少研究课题，怎么不能像计生系统一样研究出一种理论，证明城管当众扒下女人的裤子是很有必要的呢？跟计生相比，城管太无能了。                 ,咋整呀？;这狗日的城管还是不是人，政府怎么全是贪官流氓，大家起来宰了这些狗日的。;如果是他妹他会这样对待吗？//@心飞扬866: //@无锡黄民菊五世://@徐国新0888: //@无锡甜甜: //@觉醒y2011: //@李-云龙: //@全震动:;,2013/10/1 9:51,rumor
【我们不要这样的广告】继俄罗斯人抗议普京举牌“我爸是李刚”后，中国品牌又在非洲打响，非洲某国，为李某某轮奸案竖起了广告牌“这里不是中国，你们想犯罪去中国。”作为崛起的大国，相信今后会有更多中国品牌屹立于全球，如：想特供，去中国当官；想玩幼女，去中国当校长；想打人，去中国当城管。转                 ,转发微博;//@Queen_lala:何以强，缘因～//@演员孙海英://@优游香草山://@大蒙眷爱的但以理: 公义使邦国高举，罪恶是人民的羞辱。（箴14：34）;这非洲图片原文不是China，好像是乌干达，网上已经辟谣过了，提醒大家;,2013/9/4 15:44,rumor
【城管手中再添一人命】2013年7月26日早上8点20分左右。四川省达州万源有一个家庭贫因的17岁在校学生。把 自己在山上捡的野山菌拿到街上来卖，遭到城管殴打，送到医院抢救无效死亡，但目前消息被封锁。 试问正义何在？公理何在？ 求扩散步！！！@假装在西安 @孔智勇- @徐昕 @时评聚焦 @袁腾飞                 ,回复@熊猫冲啊冲:辟谣;四川万源市政府：网传“万源城管打死人”系谣传--法治--人民网 http://t.cn/zQxVJdm 的确是谣传，我就在万源。;TMD这种嚣张谁来管，从根本来说还是这个队伍总体素质低下;,2013/7/26 22:56,rumor
求鉴定是否又是临时工：四川省达州万源17岁在校学生摆卖野生菌 被城管打死 - 【城管手中再添一人命2013年7月26日早上8点20分左右。四川省达州万源有一个家庭贫因的17岁在校学生。把 自己在山上捡的野山菌拿到街上来卖，遭到城管殴打，送到医院抢救无效死亡，但目前消息被封锁。 http,,2013/7/28 22:06,rumor
【城管手中再添一人命】2013年7月26日早上8点20分左右。四川省达州万源有一个家庭贫因的17岁在校学生。把 自己在山上捡的野山菌拿到街上来卖，遭到城管殴打，送到医院抢救无效死亡，但目前消息被封锁。 试问正义何在？公理何在？ 求扩散！！！求公理，求扩散。@1句实话 @新闻已死 @作业本 ,,2013/7/28 15:40,rumor
正气文天祥：@木子七小生 【城管手中再添一人命】2013年7月26日早上8点20分左右。四川省达州万源有一个家庭贫因的17岁在校学生。把 自己在山上捡的野山菌拿到街上来卖，遭到城管殴打，送到医院抢救无效死亡，但目前消息被封锁。 试问正义何在？公理何在？ 求扩散！！！求公理，求扩散。                 ,,2013/7/28 0:15,rumor
[转载]四川达州城管打死学生千人围堵市委(组图) [转载]四川达州城管打死学生      千人围堵市委(组图),;,2013/7/28 16:13,rumor
四川大学生假期摆摊打工遭数名城管殴打致死 http,,2013/7/29 15:54,rumor
  2013年7月26日早上，四川达州万源市，城管暴力执法，打死一名靠卖野生蘑菇挣学费的19岁学生。  27日，死者亲友及同学高举“万源市城管群殴一学生，... ——看到老常的博文《[转载]四川达州城管打死学生 千人围堵市委(组图)》有感而发的评论。[转载]四川达州城管打死学生 千人围堵市委(组图),,2013/7/28 19:17,rumor
分享自岁月如歌  《[转载]四川达州城管打死学生 千人围堵市委(组图)》 - 原文地址：四川达州城管打死学生 千人围堵市委(组图)作者：competa2013年7月26日早上，四川达州万源市，城管暴...  (来自 @头条博客) - [转载]四川达州城管打死学生千人围堵市委(组图)                  ,新华网已发布新闻辟谣。http://t.cn/zQJ7sbC;,2013/7/28 19:03,rumor
孩子啊，妈去街上卖点山竹，挣完钱了给你买点肉吃，娘知道你一星期没吃到肉啦。”重庆一妇女对她孩子说。孩子开心回答：“好啊，好啊，中午我在家先洗菜淘米，等你回家来烧饭哦”——想不到半路上遇到城管执法把她推下台阶成了永别！旁边的小贩说，这名妇女卖水果辛苦拉扯3个孩子。                 ,"转发抽奖@关注我们 转发主页活动奖2斤车厘子活动,淘宝开店特价秒杀,动动手指抽车厘子免费吃;转发微博;这个世界怎么了;",2013/7/27 21:35,rumor
【万源城管打死卖蘑菇学生 千人围堵市委讨还公道】昨天早上，达州万源城管暴力执法，打死卖蘑菇挣学费的穷苦学生。今天上午，死者亲友、同学高举“天理难容”的横幅，在市委门口请愿，要求秉公执法、严惩凶手！逾千市民赶来声援，大批警察、武警与群众对峙，将追讨公道的市民强行驱散……,城管?.呼唤杨大侠!;好友周末愉快;//@法外正气: //@南阳奥奔小杨11：//@爱欣萝卜: //@SI天使: 千辛万苦卖磨姑得几文？一言不语被打死莫理由！横批：血色磨姑;,2013/7/27 17:11,rumor
《有消息四川万源卖蘑菇被打伤学生已经死亡》 孩子高考600多分，考入重本。家境贫寒，将爷爷采的蘑菇来城里卖，以拼凑学费，被城管殴打致死。老百姓围了市政府！中国特色的城管狂妄无忌，视百姓的生命财产如草芥，将暴政展现的淋漓尽致。请网友转起来，为这个无助的家庭讨还公道！,?.--老婆出轨和上司偷情，这是我捉jian时拍到的。。。。。。。 http://t.cn/RZQaKKM .......来;居然敢在野外野战，还有没有羞耻感。。。。。。 http://t.cn/RZhg62P;回复@慈鸣少音:;,2013/7/27 14:18,rumor
城管群殴一名勤工俭学的学生将其打死！天涯社区网：2013年7月26日8点，四川省万源市河街一名靠卖野生蘑菇挣学费的17岁学生，被一群城管群殴，其中一名城管用秤砣击打学生头部数下，导致大量出血在送往医院抢救的途中不治身亡，一个17岁少年梦想才刚刚起步，就这样断送在这群野狼的手中！                 ,;四川万源市政府：网传“万源城管打死人”系谣传--法治--人民网 http://t.cn/zQxVJdm 的确是谣传，我就在万源。;//@没有北京户口: 这帮狗杂种，是谁给了他们这种权利！？丧尽天良，终会受报应的！//@自由耀颖: 我靠，又是城管，又是秤砣。 //@香港卫视:转发微博;,2013/7/27 7:30,rumor
 【城管手中再添一人命]】2013年7月26日早上8点20分左右。四川省达州万源有一个家庭贫因的17岁在校学生。把 自己在山上捡的野山菌拿到街上来卖，遭到城管殴打，送到医院抢救无效死亡，但目前消息被封锁。 天理何在？ 我在,,2013/7/27 20:19,rumor
【又是秤砣，网传万源城管打死17岁学生！】 网友@曾小贤Alan 爆料：26日早上8点20分左右。四川省达州万源有一个家庭贫因的17岁在校学生，把自己在山上捡的野山菌拿到街上来卖，遭到城管用秤砣击打学生头部数下，导致大量出血在送往医院抢救的途中不治身亡，但目前消息被封锁。（@直播成都）                 ,建议他爸妈，直接去北京，早上升旗的时候开闹。还不信没人管了！;真的？！！;是真的;,2013/7/27 9:19,rumor
昨天城管打死卖野菜学生事件，据说又用的是神秘武器：秤砣！                 ,还不删？[lxhx挠]//@点子正: 挂贱人;比删除了好——清清楚楚的告诉人们，谣言是怎么回事。//@静心_境心: @微博管理员 就是这么处理不实消息的？！//@点子正: 挂贱人;最近流行打老鼠了？;,2013/7/27 1:25,rumor
【城管手中再添一人命】2013年7月26日早上8点20分左右。四川省达州万源有一个家庭贫因的17岁在校学生。把 自己在山上捡的野山菌拿到街上来卖，遭到城管殴打，送到医院抢救无效死亡，但目前消息被封锁。 试问正义何在？公理何在？ 求扩散步！！！@杂谈五味 @香港報紙                 ,回复@我是水哥_别开枪:😂我他妈现在正打算移民;无风不起浪！内容不真简直就是放屁，人命关天不做解释吗？更是放屁，估计你家小孩没有屁眼，该有的屁都没你放了，本来不想骂人的，看到你他妈做事太果断了！;无风不起浪！内容不真简直就是放屁，人命关天不做解释吗？更是放屁，估计你家小孩没有屁眼，该有的屁都没你放了，本来不想骂人的，看到你他妈做事太果断了;,2013/7/26 19:03,rumor
【逆天了，城管打死17岁学生】 2013年7月26日早上8点20分左右。四川省达州万源有一个家庭贫因的17岁在校学生。把 自己在山上捡的野山菌拿到街上来卖，遭到城管殴打，送到医院抢救无效死亡，但目前消息被封锁。公理何在？  VIA @丁来峰                 ,转发微博;畜生，遭狗日勒！//@清鬼刺青-火力: 日你妈中国要逆天是不是？老子真的想把这些杂碎千刀万剐！！恨啊;@Camille鲁鲁 达州娃儿。。。;,2013/7/27 8:58,rumor
今天终于亲眼见到了城管暴力执法，真是往死里打啊！一群年轻力壮的城管围殴一个板车小贩，而且下死手，根本不管是不是要害。图中人已经被按在车上了，后脑、脊柱等致命部位暴露无遗。如果不是围观群众上来解围恐怕非死即残。山东那哥们必然也是这么被打残废的。vi a@赖小特特                  ,回复@车厘子Fleury:应该会比现状好点;回复@上铺的同志:学历不等于素质!;一群土匪么;,2013/7/22 11:21,rumor
顶！// 本是同根生，相煎何太急，今天发生在弱民身上，明天他的儿子可能就要你父亲的命【今天终于亲眼见到了城管暴力执法，...】！http,,2013/7/22 15:13,rumor
今天终于亲眼见到了城管暴力执法，真是往死里打啊！ - 今天终于亲眼见到了城管暴力执法，真是往死里打啊！一群年轻力壮的城管围殴一个板车小贩，而且下死手，根本不管是不是要害。发博当事人还称：地点就西直门。我手机差点被砸。网友吐槽：这两天已经被城管黑的，无...   http,,2013/7/22 22:10,rumor
 【今天终于亲眼见到了城管暴力执法，...】今天终于亲眼见到了城管暴力执法，真是往死里打啊！一群年轻力壮的城管围殴一个板车小贩，...！ http,,2013/7/22 22:43,rumor
今天终于亲眼见到了城管暴力执法，真是往死里打啊！一群年轻力壮的城管围殴一个板车小贩，什么飞踹，王八拳，铁沙掌，连环踢，好有恨都用上了。而且下死手，根本不管是不是要害。图中这个可怜人已经被按在车上了，后脑、脊柱等致命部位暴露无遗。擦，谁他妈给你们权力这么对待老百姓的！,,2013/7/22 16:19,rumor
城市管理者？谁付予你们屠戮百姓的权力？ 【今天终于亲眼见到了城管暴力执法，...】今天终于亲眼见到了城管暴力执法，真是往死里打啊...！ http,,2013/7/24 11:22,rumor
"分享自HUMAN  《[转载]终于亲眼见到了》 - 原文地址：终于亲眼见到了作者：马蜂不蜇棍子捅48龙鳗：今天终于亲眼见到了城管暴力执法,真是往死里打啊！一群年轻力壮的城管...  (来自 @头条博客) -    [转载]终于亲眼见到了",,2013/7/23 13:54,rumor
国家富了，不差钱！--- - 今天终于亲眼见到了城管暴力执法，真是往死里打啊！一群年轻力壮的城管围殴一个板车小贩，而且下死手，根本不管是不是要害。发博当事人还称：地点就西直门。我手机差点被砸。网友吐槽：这两天已经被城管黑的，无...   http,,2013/7/23 21:47,rumor
网友爆料今天终于亲眼见到了城管暴力执法，真是往死里打啊！一群年轻力壮的城管围殴一个板车小贩，而且下死手。图中人已经被按在车上了，后脑脊柱等致命部位暴露无遗。如果不是群众上来解围恐怕非死即残。山东那哥们必然也是这么被打残废的。谁给你们权力这么对待老百姓的！在西直门桥北路西@凤凰网                 ,中国如果发生战争把各个城市的城管先拉到前线战场倒退一步毙;,2013/7/22 17:12,rumor
"今天終於親眼見到了城管暴力執法,真是往死裏打啊！一群年輕力壯的城管圍毆一個板車小販,而且下死手,根本不管是不是要害,圖中人已經被按在車上了,後腦、脊柱等致命部位暴露無遺,如果不是圍觀群眾上來解圍恐怕非死即殘,山東那哥們必然也是這麼被打殘廢的,操,誰他媽給你們權力這麼對待老百姓的！ by賴小特                 ",转发微博;,2013/7/22 14:19,rumor
@赖小特特 亲眼见到北京城管暴力执法！一群年轻力壮城管围殴一板车小贩！真是往死里打！这是近期北京城管被曝光的第二次了！ http,微博的作者已经发微博，证明这条是假新闻，请去关注作者的最新微博;假消息！;您好，亲~，这是我的官方微博，是发布一些关于，婚纱美图的趣闻的，希望能得到亲的关注和支持哈。以后在微博上多多交流哦。如果给你骚扰，小编深感抱歉。;,2013/7/22 10:34,rumor
@赖小特特 这个七月，城管升级为街道BOSS 了。果真要逆天。 尤其是圈上的那俩，下手真够狠的。 人老百姓是和你有杀父之仇 还是夺妻之恨？扣了你们家祖坟。 闭着眼抬手的大哥，是在演戏吗？ #城管7月#                 ,判定结果 经查，此微博中称“北京西直门桥北路西惊现城管暴力执法”，而经海淀警方证实实际为在西直门北大街一饭馆门口有地产公司员工打架，详情：http://t.cn/zQVqVQQ 。;,2013/7/23 10:02,rumor
【脱裤维稳～】對付女小贩，我城管採取脫褲維穩法；7月2日，惠州惠城區河南岸上馬庄启明苑门前一幕。转～                 ,博主造谣，那里有维稳了，这分明是一小撮土匪带领一群小混混在耍流氓嘛[挖鼻屎];//@倚苍天屠巨龙: 转发微博;;,2013/7/22 0:07,rumor
今天终于亲眼见到了城管暴力执法，真是往死里打啊！一群年轻力壮的城管围殴一个板车小贩，而且下死手，根本不管是不是要害。山东炸机场那哥们必然也是这么被打残废的。操，谁他妈给你们权力这么对待老百姓的！ 我在这里,,2013/7/22 21:13,rumor
@赖小特特 发博称，今天终于亲眼见到了城管暴力执法，真是往死里打啊！一群年轻力壮的城管围殴一个板车小贩，而且下死手，根本不管是不是要害。图中人已经被按在车上了，后脑、脊柱等致命部位暴露无遗。如果不是围观群众上来解围恐怕非死即残。城管，我qnmlgb                 ,,2013/7/22 19:46,rumor
【首都城管怎么可能自甘落后！】今天，北京西直门桥北路西惊现城管暴力执法！一群年轻力壮的城管围殴一个板车小贩，下死手！根本不管是不是要害，往死里打。图中男子已被按在板车上，后脑、脊柱等致命部位暴露无遗，后面砸过来的钢盔，配以狰狞的目光，不忍直视！你以为只有临武、哈尔滨的城管牛吗？                 ,贪官心虚了！昨天还共青团总部的大V，怎么今天就取消了？新浪后台有记录的，你消得了吗？你用这个共青团总部大V欺骗了多少女人！ 【钏允 http://weibo.com/u/1726276205 . . 共青团中央委员会 总部 |北京 东城区 |毕业于中国人民大学 | 标签◆ 】 . . 钏允 ..;这个社会怎么了？？？？？？悲哀！！！！！！！！！！！！！;那你这种人 如何活到今日？;,2013/7/22 13:46,rumor
今天终于亲眼见到了城管暴力执法，真是往死里打啊！一群年轻力壮的城管围殴一个板车小贩，而且下死手，根本不管是不是要害。图中人已经被按在车上了，后脑、脊柱等致命部位暴露无遗。如果不是围观群众上来解围恐怕非死即残。山东那哥们必然也是这么被打残废的。操，谁他妈给你们权力这么对待老百姓的！                 ,中国人寿保险公司是否？骗人;回复@央美郝昕:鄂？谢谢告知。那我也得道歉。;回复@佘大鹏:关心错了方向。;,2013/7/22 9:58,rumor
【分享图片】临武县委副书记、县长贺遵庆个人资料简历：其中有两句“在职研究生学历，维稳学硕士学位”。——不看不知道，竟然还有一门学科叫“维稳学”，还有硕士学位！真长见识了！随着社会的发展，估计还会有城管博士，截访学教授，拆迁学院士.....                 ,当真?;你也是做新闻的人，明显的恶搞分不出来吗？;纳尼？;,2013/7/18 23:03,rumor
#经济解释#又不是李天一，惠州城管拔人家女小贩的裤子干什么？                 ,男的穿红内裤？？？我真怀疑举报人的举报动机;是啊，不好好研究下新闻真相，让被刺的城管情何以堪啊？！;还女小贩，是男的好不好，拿刀捅伤人被制服了，是非真相都分不清！广东电视台DV现场的事实真相 http://t.cn/zQ7uSno;,2013/7/7 7:00,rumor
