#BWF世界羽联##里约奥运羽毛球# 徐晨/马晋战胜了伦敦奥运会铜牌得主丹麦组合尼尔森/佩德森，成功晋级后，@MJ0507 说道：“这三天没有人知道我们经历了什么，每一天都要顶住压力去想着赢球。半年前我就提过退役，但是队伍需要我就留下来接着打。” 另外马晋还感谢了林丹昨天的开导@徐晨XUCHEN 则表示：“今天与马晋积极调整了心态，希望能做好眼前。” http,徐晨马晋的1/4比赛是什么时候？;加油哦！！尽力就好！！;马晋声音很好听;,2016/8/13 23:59,non-rumor
"怎么我一夸人，那人就被淘汰了😂解说也是逗：""第一轮世界纪录走了，第二轮奥运会记录走了，现在第四轮世界排名第一也走了""  ",,2016/8/13 23:59,non-rumor
"棒棒的，加油加油！其实我觉得奥运会不应该总给老将压力，应该更多的去关注新人。  
原始用户",,2016/8/13 23:59,non-rumor
#SOAR发售# NIKE WOMEN’S MOMENTS IN OLYMPIC CITY PACK就是为了纪念属于女性运动员的历史时刻而设计的城市版运动鞋。洛杉矶：源自洛杉矶奥运会第一次参加女子马拉松比赛夺金的JOAN BENOIT的，洛杉矶 CORTEZ ULTRA LOTC QS，零售价：¥699。于2016-8-14早上11：00正式发售，欢迎前来选购。@AJCLUB @NikeSportswear [组图共9张] 原图 ,,2016/8/13 23:59,non-rumor
借着里约奥运会我也来运动一下 香港特别行政区·Manly 秒拍视频 .  显示地图 ,哈哈哈哈哈哈，我刚看见这视频、太逗了！“咣”把你一扔，姥姥太逗了;,2016/8/13 23:59,non-rumor
每次看奥运会运动员拼命冲刺的那一刻，我都激动的要哭…  原图 ,,2016/8/13 23:59,non-rumor
#围观里约奥运会#谢震业百米第一轮小组第一晋级，张培萌小组第七。  原图 ,,2016/8/13 23:59,non-rumor
这次奥运代表团，总体心里压力太大，整体发挥不好，应该是进来几届奥运会成绩比较差的一次。压力呀  ,,2016/8/13 23:59,non-rumor
